{"schema_version":"review_context.v1","review_id":"rv-31","repo":"gcp-reviewer-agent","base_sha":"240e49c","head_sha":"9bddbb8","unit":{"unit_id":"u7","lens":"simple","file":"src/agent/reviewer.ts","hunks":["@@ -40,6 +40,24 @@ ..."]},"symbols":[{"ref":"src/agent/reviewer.ts#reviewUnit","signature":"(unit: EvaluationUnit) => Promise<ReviewResult>","visibility":"internal","callers":3},{"ref":"src/telemetry/redact.ts#redact","signature":"(value: unknown) => unknown","visibility":"shared","purpose":"Strip secrets from values before they reach logs or span attributes."}],"symbols_truncated":false,"known_findings":[{"source":"sonar","rule":"S3776","line":40}],"rules":["reuse-map","boundary"],"budget":{"max_output_tokens":600,"evidence_rounds":1,"model_calls_max":2},"evidence":[]}
